{
  "nodes": [
    {
      "children": [
        {
          "children": [
            {
              "children": [],
              "name": "foo.java",
              "link": "",
              "attributes": {
                "rloc": 3,
                "mcc": 2
              },
              "type": "File"
            }
          ],
          "name": "foo.java",
          "link": "",
          "attributes": {},
          "type": "Folder"
        },
        {
          "children": [
            {
              "children": [],
              "name": "bar.kt",
              "link": "",
              "attributes": {
                "rloc": 4,
                "mcc": 1
              },
              "type": "File"
            }
          ],
          "name": "bar.kt",
          "link": "",
          "attributes": {},
          "type": "Folder"
        }
      ],
      "name": "root",
      "link": "",
      "attributes": {},
      "type": "Folder"
    }
  ],
  "apiVersion": "1.1",
  "attributeTypes": {},
  "edges": [],
  "blacklist": [],
  "projectName": "foo"
}
